{
  "build_cycle": "2025-11-09T04:15:23.456789Z",
  "project": "vulnerable-webapp",
  "commit_hash": "a1b2c3d4e5f6789012345678901234567890abcd",
  "branch": "main",
  "sbom": {
    "format": "CYCLONEDX",
    "location": "/home/user/projects/webapp/artifacts/sbom.json",
    "size_bytes": 45678,
    "tool": "trivy"
  },
  "compliance": [
    {
      "tool": "Trivy",
      "violations": [
        {
          "severity": "CRITICAL",
          "rule_id": "CVE-2021-44228",
          "description": "Apache Log4j2 2.0-beta9 through 2.15.0 (excluding security releases 2.12.2, 2.12.3, and 2.3.1) JNDI features used in configuration, log messages, and parameters do not protect against attacker controlled LDAP and other JNDI related endpoints. An attacker who can control log messages or log message parameters can execute arbitrary code loaded from LDAP servers when message lookup substitution is enabled.",
          "file": "pom.xml",
          "line": null,
          "package": "org.apache.logging.log4j:log4j-core",
          "version": "2.14.0",
          "fixed_version": "2.17.1, 2.12.4, 2.3.2",
          "vulnerability_id": "CVE-2021-44228",
          "ai_fix": "## Remediation for CVE-2021-44228 (Log4Shell)\n\n### Immediate Action Required\n\nThis is a **critical remote code execution vulnerability**. Update log4j-core immediately.\n\n### Step 1: Update pom.xml\n\n```xml\n<dependency>\n  <groupId>org.apache.logging.log4j</groupId>\n  <artifactId>log4j-core</artifactId>\n  <version>2.17.1</version>\n</dependency>\n<dependency>\n  <groupId>org.apache.logging.log4j</groupId>\n  <artifactId>log4j-api</artifactId>\n  <version>2.17.1</version>\n</dependency>\n```\n\n### Step 2: Rebuild and Deploy\n\n```bash\nmvn clean install\nmvn package\n```\n\n### Step 3: Verify Fix\n\n```bash\n# Check dependency tree\nmvn dependency:tree | grep log4j\n\n# Should show version 2.17.1 or later\n```\n\n### Step 4: Test Application\n\n1. Start the application in a test environment\n2. Verify logging still works correctly\n3. Check for any compatibility issues\n4. Deploy to production\n\n### Alternative: Temporary Mitigation (if immediate upgrade not possible)\n\nSet the following JVM property:\n```bash\n-Dlog4j2.formatMsgNoLookups=true\n```\n\n**Note:** This is NOT a complete fix. Upgrade is still required.",
          "ai_provider": "anthropic",
          "ai_model": "claude-sonnet-4-5-20250929"
        },
        {
          "severity": "CRITICAL",
          "rule_id": "CVE-2019-14234",
          "description": "Django: SQL injection possibility in key and index lookups for JSONField/HStoreField",
          "file": "requirements.txt",
          "line": null,
          "package": "django",
          "version": "1.11.0",
          "fixed_version": "1.11.23, 2.1.11, 2.2.4",
          "vulnerability_id": "CVE-2019-14234",
          "ai_fix": "## Fix Django SQL Injection Vulnerability\n\nUpdate Django to a patched version:\n\n```bash\npip install 'django>=1.11.23'\n```\n\nOr in requirements.txt:\n```\ndjango>=1.11.23,<2.0  # If staying on 1.x\ndjango>=2.2.4         # If upgrading to 2.x\n```\n\nAfter updating:\n```bash\npip install -r requirements.txt\npython manage.py migrate\npython manage.py test\n```",
          "ai_provider": "anthropic",
          "ai_model": "claude-sonnet-4-5-20250929"
        },
        {
          "severity": "HIGH",
          "rule_id": "KSV014",
          "description": "Root file system is not read-only",
          "file": "k8s/deployment.yaml",
          "line": 18,
          "ai_fix": "## Make Root Filesystem Read-Only\n\nUpdate your Kubernetes deployment to use a read-only root filesystem:\n\n```yaml\napiVersion: apps/v1\nkind: Deployment\nmetadata:\n  name: myapp\nspec:\n  template:\n    spec:\n      containers:\n      - name: app\n        image: myapp:latest\n        securityContext:\n          readOnlyRootFilesystem: true\n          runAsNonRoot: true\n          runAsUser: 1000\n        volumeMounts:\n        # Mount writable volumes for directories that need write access\n        - name: tmp\n          mountPath: /tmp\n        - name: cache\n          mountPath: /app/cache\n      volumes:\n      - name: tmp\n        emptyDir: {}\n      - name: cache\n        emptyDir: {}\n```\n\n**Why this matters:** A read-only root filesystem prevents attackers from modifying system files or installing malicious binaries.",
          "ai_provider": "anthropic",
          "ai_model": "claude-sonnet-4-5-20250929"
        }
      ]
    },
    {
      "tool": "Checkov",
      "violations": [
        {
          "severity": "HIGH",
          "rule_id": "CKV_K8S_8",
          "description": "Liveness Probe Should Be Configured",
          "file": "k8s/deployment.yaml",
          "line": 15
        },
        {
          "severity": "MEDIUM",
          "rule_id": "CKV_K8S_20",
          "description": "Containers should not run with allowPrivilegeEscalation",
          "file": "k8s/deployment.yaml",
          "line": 22,
          "ai_fix": "## Disable Privilege Escalation\n\nAdd security context to prevent privilege escalation:\n\n```yaml\ncontainers:\n- name: myapp\n  securityContext:\n    allowPrivilegeEscalation: false\n    capabilities:\n      drop:\n        - ALL\n    runAsNonRoot: true\n    runAsUser: 1000\n```",
          "ai_provider": "anthropic",
          "ai_model": "claude-sonnet-4-5-20250929"
        }
      ]
    }
  ],
  "sast": [
    {
      "tool": "Semgrep",
      "issues": [
        {
          "severity": "HIGH",
          "rule_id": "javascript.express.security.audit.express-check-csurf-middleware-usage",
          "description": "Missing CSRF protection middleware in Express application",
          "file": "src/routes/api.js",
          "line": 25,
          "ai_fix": "## Add CSRF Protection to Express\n\n### Step 1: Install csurf middleware\n\n```bash\nnpm install csurf cookie-parser\n```\n\n### Step 2: Configure in your app\n\n```javascript\nconst express = require('express');\nconst cookieParser = require('cookie-parser');\nconst csrf = require('csurf');\n\nconst app = express();\n\n// Parse cookies (required for CSRF)\napp.use(cookieParser());\n\n// Setup CSRF protection\nconst csrfProtection = csrf({ cookie: true });\n\n// Apply to all routes that need protection\napp.use(csrfProtection);\n\n// Make CSRF token available to views\napp.use((req, res, next) => {\n  res.locals.csrfToken = req.csrfToken();\n  next();\n});\n```\n\n### Step 3: Include token in forms\n\n```html\n<form method=\"POST\" action=\"/api/data\">\n  <input type=\"hidden\" name=\"_csrf\" value=\"{{csrfToken}}\">\n  <!-- other form fields -->\n</form>\n```\n\n### Step 4: Include in AJAX requests\n\n```javascript\nfetch('/api/data', {\n  method: 'POST',\n  headers: {\n    'CSRF-Token': csrfToken,\n    'Content-Type': 'application/json'\n  },\n  body: JSON.stringify(data)\n});\n```",
          "ai_provider": "anthropic",
          "ai_model": "claude-sonnet-4-5-20250929"
        },
        {
          "severity": "HIGH",
          "rule_id": "python.lang.security.audit.dangerous-system-call",
          "description": "Detected use of shell=True in subprocess call, which can lead to command injection",
          "file": "src/utils/execute.py",
          "line": 42,
          "ai_fix": "## Fix Command Injection Vulnerability\n\n### Current Code (Vulnerable):\n\n```python\nimport subprocess\n\n# DANGEROUS - vulnerable to command injection\ndef run_command(user_input):\n    subprocess.call(f\"ls {user_input}\", shell=True)\n```\n\n### Fixed Code:\n\n```python\nimport subprocess\nimport shlex\n\ndef run_command(user_input):\n    # Option 1: Use list format (preferred)\n    subprocess.call(['ls', user_input])\n    \n    # Option 2: If you must use shell=True, sanitize input\n    safe_input = shlex.quote(user_input)\n    subprocess.call(f\"ls {safe_input}\", shell=True)\n    \n    # Option 3: Best practice - avoid shell entirely\n    result = subprocess.run(\n        ['ls', user_input],\n        capture_output=True,\n        text=True,\n        check=True\n    )\n    return result.stdout\n```\n\n### Key Points:\n\n1. **Never use shell=True with user input**\n2. **Use list format for arguments** - Python will properly escape them\n3. **If shell=True is required**, use `shlex.quote()` to sanitize input\n4. **Prefer subprocess.run()** over subprocess.call() for better control",
          "ai_provider": "anthropic",
          "ai_model": "claude-sonnet-4-5-20250929"
        }
      ]
    },
    {
      "tool": "Bandit",
      "issues": [
        {
          "severity": "MEDIUM",
          "rule_id": "B608",
          "description": "Possible SQL injection vector through string-based query construction",
          "file": "src/database.py",
          "line": 156,
          "ai_fix": "## Fix SQL Injection Vulnerability\n\n### Current Code (Vulnerable):\n\n```python\ndef get_user(user_id):\n    # DANGEROUS - SQL injection risk\n    query = f\"SELECT * FROM users WHERE id = {user_id}\"\n    cursor.execute(query)\n```\n\n### Fixed Code:\n\n```python\ndef get_user(user_id):\n    # SAFE - parameterized query\n    query = \"SELECT * FROM users WHERE id = ?\"\n    cursor.execute(query, (user_id,))\n    \n    # Or with named parameters\n    query = \"SELECT * FROM users WHERE id = :user_id\"\n    cursor.execute(query, {\"user_id\": user_id})\n```\n\n### For SQLAlchemy:\n\n```python\nfrom sqlalchemy import text\n\ndef get_user(user_id):\n    query = text(\"SELECT * FROM users WHERE id = :user_id\")\n    result = db.session.execute(query, {\"user_id\": user_id})\n    \n    # Or use ORM (best practice)\n    user = User.query.filter_by(id=user_id).first()\n```\n\n**Never concatenate user input into SQL queries!**",
          "ai_provider": "anthropic",
          "ai_model": "claude-sonnet-4-5-20250929"
        },
        {
          "severity": "LOW",
          "rule_id": "B105",
          "description": "Possible hardcoded password",